{
  "schemaVersion": "1.0",
  "id": "run-c950df7607b5",
  "benchmarkId": "integrated-robotic-handling",
  "benchmarkVersion": "1.10",
  "launchId": "integrated-robotic-handling-v3",
  "cohortId": "cohort-4b5b5f377a1b",
  "taskPacketDigest": "b8622ce708f8e7464b3a1c22c11afcadc5ae9117c388ced617713b549397579f",
  "taskPacketBundleDigest": "5f8081cc853a0665729885c4cfb3ac9883a8ecb7e1dff0a78c96e24f2391a053",
  "executionContractDigest": "676b7116dea227f181a3d7f072e542f09bdc1b738816a9e246b3273c7cb0c194",
  "promptSha256": "e06bf42926526485f04b2b880f46052a16a59aeefce61d17f1098e5e911d0a1c",
  "launchDigest": "0046d640d935e28619a61a15939d661a57ea72023201c73047f03342baff6cb8",
  "fairnessFingerprint": "660af2de7e63f0764a922e7568f93f59def7fdb4df0c1c216d4f8c16865cb255",
  "status": "published",
  "submittedAt": "2026-07-30T09:12:42.651Z",
  "seal": {
    "bundleSha256": "cac111450427aad79a409fe4479c9827baa52a2b93229c23eb3f1e6c8a576ac9",
    "algorithm": "sha256-tree-v1"
  },
  "artifacts": [],
  "validation": {
    "path": "validation-summaries/run-c950df7607b5.json",
    "sha256": "dd691631a2a580a81605972476de4d155412eff7f96014fdf9490d8a11e337ca"
  },
  "evaluation": {
    "path": "evaluation-summaries/run-c950df7607b5.json",
    "sha256": "1a82a4a4df149c52c44eb8a48de6c980eab0780ac3be066aefe38c3ba74f9feb"
  }
}
