{
  "schemaVersion": "1.0",
  "id": "run-96103c9f6c9a",
  "benchmarkId": "integrated-robotic-handling",
  "benchmarkVersion": "1.10",
  "launchId": "integrated-robotic-handling-v3",
  "cohortId": "cohort-4b5b5f377a1b",
  "taskPacketDigest": "b8622ce708f8e7464b3a1c22c11afcadc5ae9117c388ced617713b549397579f",
  "taskPacketBundleDigest": "5f8081cc853a0665729885c4cfb3ac9883a8ecb7e1dff0a78c96e24f2391a053",
  "executionContractDigest": "676b7116dea227f181a3d7f072e542f09bdc1b738816a9e246b3273c7cb0c194",
  "promptSha256": "e06bf42926526485f04b2b880f46052a16a59aeefce61d17f1098e5e911d0a1c",
  "launchDigest": "0046d640d935e28619a61a15939d661a57ea72023201c73047f03342baff6cb8",
  "fairnessFingerprint": "660af2de7e63f0764a922e7568f93f59def7fdb4df0c1c216d4f8c16865cb255",
  "status": "published",
  "submittedAt": "2026-07-30T09:08:22.822Z",
  "seal": {
    "bundleSha256": "dd451683597ae6eefdad93bfe8d622e74ec7d6974b316a253924a579193182f8",
    "algorithm": "sha256-tree-v1"
  },
  "artifacts": [],
  "validation": {
    "path": "validation-summaries/run-96103c9f6c9a.json",
    "sha256": "30fa2b44c2fd75f2fa19cb82b1b025355a16ab0cdb7ff5a0a2eae74d2d9d815d"
  },
  "evaluation": {
    "path": "evaluation-summaries/run-96103c9f6c9a.json",
    "sha256": "ee02473561e0f279454104e4c15048b0129f4d136dda6cca0c9b5af9b199216c"
  }
}
